{
  "predicates": [
    {
      "expanded": "Source Type",
      "value": "source-type"
    },
    {
      "expanded": "Lifetime of the information as Open Source Intelligence",
      "value": "lifetime"
    },
    {
      "expanded": "Certainty of the elements mentioned in this Open Source Intelligence",
      "value": "certainty"
    }
  ],
  "version": 7,
  "description": "Open Source Intelligence - Classification (MISP taxonomies)",
  "namespace": "osint",
  "values": [
    {
      "predicate": "source-type",
      "entry": [
        {
          "value": "blog-post",
          "expanded": "Blog post"
        },
        {
          "value": "microblog-post",
          "expanded": "Microblog post like Twitter"
        },
        {
          "value": "technical-report",
          "expanded": "Technical or analysis report"
        },
        {
          "value": "news-report",
          "expanded": "News report"
        },
        {
          "value": "pastie-website",
          "expanded": "Pastie-like website"
        },
        {
          "value": "electronic-forum",
          "expanded": "Electronic forum"
        },
        {
          "value": "mailing-list",
          "expanded": "Mailing-list"
        },
        {
          "value": "block-or-filter-list",
          "expanded": "Block or Filter List"
        },
        {
          "value": "source-code-repository",
          "expanded": "Source code repository"
        },
        {
          "value": "expansion",
          "expanded": "Expansion"
        },
        {
          "value": "automatic-analysis",
          "expanded": "Automatic analysis including dynamic analysis or sandboxes output"
        },
        {
          "value": "automatic-collection",
          "expanded": "Automatic collection including honeypots, spamtramps or equivalent technologies"
        },
        {
          "value": "manual-analysis",
          "expanded": "Manual analysis or investigation"
        },
        {
          "value": "unknown",
          "expanded": "Unknown"
        },
        {
          "value": "other",
          "expanded": "Other source not specified in this list"
        }
      ]
    },
    {
      "entry": [
        {
          "description": "Information available publicly on long-term",
          "expanded": "Perpetual",
          "value": "perpetual"
        },
        {
          "description": "Information available publicly on short-term",
          "expanded": "Ephemeral",
          "value": "ephemeral"
        }
      ],
      "predicate": "lifetime"
    },
    {
      "entry": [
        {
          "description": "100% Certainty",
          "expanded": "100% Certainty",
          "value": "100",
          "numerical_value": 100
        },
        {
          "description": "93% Almost certain",
          "expanded": "93% Almost certain",
          "value": "93",
          "numerical_value": 93
        },
        {
          "description": "75% Probable",
          "expanded": "75% Probable",
          "value": "75",
          "numerical_value": 75
        },
        {
          "description": "50% Chances about even",
          "expanded": "50% Chances about even",
          "value": "50",
          "numerical_value": 50
        },
        {
          "description": "30% Probably not",
          "expanded": "30% Probably not",
          "value": "30",
          "numerical_value": 30
        },
        {
          "description": "7% Almost certainly not",
          "expanded": "7% Almost certainly not",
          "value": "7",
          "numerical_value": 7
        },
        {
          "description": "0% Impossibility",
          "expanded": "0% Impossibility",
          "value": "0",
          "numerical_value": 0
        }
      ],
      "predicate": "certainty"
    }
  ]
}
